Question,Answer,Brand
What does Comfort fabric conditioner do?,"Comfort isn’t just a fabric softener—it’s your clothes’ best friend. It softens, freshens, and protects fabrics from damage, helping them look newer for longer. Try Comfort Perfume Deluxe for a luxury scent experience!",Comfort
Is Comfort safe for baby clothes?,"Yes! Comfort Pure is dermatologically tested and hypoallergenic, making it perfect for delicate baby clothes and sensitive skin.",Comfort
How do I use Comfort fabric conditioner correctly?,Just pour Comfort into the final rinse cycle or fabric conditioner compartment. Use Comfort Dilute or Comfort Ultra depending on your laundry load. No rinsing needed after!,Comfort
Does Comfort help reduce wrinkles in clothes?,"Yes, Comfort softens fabric fibers which helps reduce creasing—making ironing easier and faster. Save time and look sharp, every day.",Comfort
Can Comfort be used with all types of washing machines?,Absolutely! Comfort is compatible with both top-load and front-load machines. It works seamlessly with all types of detergents too.,Comfort
Does Comfort Antibac remove germs?,"Yes, Comfort Antibac not only softens clothes but also helps eliminate up to 99.9% of germs—perfect for school uniforms, gym wear, and daily essentials.",Comfort
Is Comfort suitable for handwashing clothes?,Yes. Just add Comfort during the last rinse while handwashing. It enhances softness and adds a long-lasting fragrance to your clothes.,Comfort
What’s the difference between Comfort Ultra and regular Comfort?,Comfort Ultra is more concentrated—meaning a little goes a long way. It’s ideal for high-efficiency machines and eco-conscious households.,Comfort
Does Comfort have long-lasting fragrance?,Definitely. Comfort Perfume Deluxe is designed with encapsulated fragrance pearls that release freshness throughout the day. Clothes smell amazing even after storage!,Comfort
Is Comfort eco-friendly?,"Yes. Comfort bottles are recyclable, and our concentrated formulas reduce water and plastic usage. We're committed to a greener future.",Comfort
What fragrance options are available in Comfort?,Explore a variety—from Fresh Jasmine to Glamorous Bouquet and Antibac. Comfort Perfume Deluxe delivers a premium fragrance experience.,Comfort
Can I use Comfort on towels and linens?,Yes! Comfort keeps towels fluffy and bed linens smooth and fresh. Your whole home feels hotel-ready every time you do laundry.,Comfort
Does Comfort protect clothes from damage?,"Yes. Comfort smooths fiber friction during washes, reducing wear and tear. Clothes stay vibrant, soft, and in shape for longer.",Comfort
Is Comfort affordable for daily use?,"Absolutely. With Comfort Ultra, just one capful is enough—making it cost-effective and long-lasting. Look for family-size packs for added savings.",Comfort
Where can I buy Comfort fabric conditioner?,"Comfort is available at all leading supermarkets, online platforms, and local stores. Look out for monthly deals and bundle offers!",Comfort
