Question,Answer,Brand
What makes Knorr cubes a must-have in every kitchen?,"Knorr cubes are your secret to 5-star taste at home. Made with real herbs, spices, and chicken essence, just one cube transforms everyday curries, rice, or soups into flavor-rich dishes. Stock up with our value packs for daily use!",Knorr
Are Knorr seasonings suitable for vegetarian meals?,"Yes! Knorr offers a wide range of vegetarian seasonings made with natural ingredients and no added preservatives. Try our Knorr Vegetable Cubes for a rich, plant-based flavor burst.",Knorr
Can I use Knorr cubes in biryani and rice dishes?,"Absolutely! Knorr Chicken or Mutton Cubes add a layer of savory depth to biryani, fried rice, and even plain rice. Just crumble and mix for aromatic, restaurant-style results.",Knorr
What dishes can I cook using Knorr Soup packets?,"From comforting Chicken Noodle Soup to Thai-style Hot & Sour, Knorr soups are perfect as starters or quick meals. Add veggies or noodles for an instant upgrade.",Knorr
Is Knorr healthy to use regularly?,"Knorr products are made with real vegetables and carefully selected spices, offering great taste without artificial preservatives. For balanced nutrition and bold flavors, Knorr is your go-to choice.",Knorr
What’s the best Knorr product for curries?,"For rich, aromatic curries, use Knorr Chicken Cubes or Knorr Professional Paste. It blends seamlessly and brings out the traditional depth of Sri Lankan curries.",Knorr
Does Knorr contain MSG?,Knorr strictly follows food safety regulations. Many of our products are MSG-free or use flavor enhancers within recommended safe limits. Always check the label to match your dietary needs.,Knorr
How do Knorr Cubes compare to homemade stock?,"Knorr Cubes offer the flavor of slow-cooked stock in a convenient format. Made with high-quality ingredients, they’re perfect for busy kitchens without compromising on taste.",Knorr
Can Knorr be used in vegetarian curries?,"Yes! Knorr Vegetable Stock Cubes and Soups are ideal for lentil-based and vegetable dishes. Enhance your dal, paneer, or curry with an extra punch of flavor.",Knorr
Do Knorr cubes dissolve easily?,"Yes, they dissolve instantly in hot liquids or when crumbled into dishes. For effortless cooking, try Knorr’s new ‘soft cube’ format now available in select packs.",Knorr
Does Knorr offer bulk or restaurant-sized packs?,"Yes. Through Knorr Food Solutions (UFS), we offer large-size professional packs tailored for restaurants, hotels, and catering services. Ask for Knorr Professional at your nearest distributor!",Knorr
What makes Knorr different from other brands?,"Knorr brings 180 years of culinary heritage, now fused with local favorites. Our cubes and mixes are crafted for authentic Sri Lankan taste, developed with chefs, for everyone.",Knorr
Is there a spicy version of Knorr seasonings?,Yes! Knorr Spicy Chicken Cubes and Hot & Spicy Soup variants are perfect for those who love an extra kick. Look for the red pack on shelves.,Knorr
Are Knorr products suitable for kids?,"Yes, Knorr products are safe and made with real ingredients. For kids, try our Classic Chicken Soup or Vegetable Soup with added pasta—wholesome and delicious!",Knorr
Can Knorr products save time in cooking?,"Absolutely. Whether it’s the quick-dissolving cubes or ready-to-mix soups, Knorr helps you cut prep time and serve tasty meals fast. It’s flavor and convenience in one.",Knorr
Any recipe ,Feel free to open https://www.rasai.lk/ for all recipe using Knorr,
